{
  "contract_version": "external-artifact/v1",
  "artifact_id": "artifact:interaction-001:001",
  "operation": "CREATE",
  "provider": "google-drive",
  "provider_file_id": "1SyntheticDriveFile_001",
  "mime_type": "application/vnd.google-apps.document",
  "category": "document",
  "created_at": "2026-08-11T20:30:00+09:00",
  "creator": {
    "agent_id": "interaction-agent",
    "version": "1.1.0"
  },
  "interaction_id": "interaction:001",
  "content_hash": "aaaaaaaaaaaaaaaaaaaaaaaaaaaaaaaaaaaaaaaaaaaaaaaaaaaaaaaaaaaaaaaa",
  "source_snapshots": [
    {
      "repository": "art-history",
      "commit": "372928427b3dcdb1921e7c2c9fe5ff2e305d51e9"
    },
    {
      "repository": "marketing-trends",
      "commit": "0f8bceeebdefa6551398f82dd8d7ccfa2630d02e"
    }
  ],
  "evidence_refs": ["signal:art:001", "signal:marketing:001"],
  "access": {
    "scope": "private",
    "consent_scope": "user-requested-output"
  },
  "retention": {
    "policy": "keep",
    "review_at": null
  },
  "lineage": {
    "derived_from": [],
    "supersedes": []
  },
  "feedback_refs": []
}
